user_input,intent,response
can you repeat,context_followup,Sure! Let me repeat the information for you. What would you like me to go over again?
i don't understand,context_followup,I'll try to clarify. Which part was unclear?
i didn't get that,context_followup,Let me rephrase that. What part would you like me to explain again?
what do you mean,context_followup,I'll clarify! Which part of my response was confusing?
please explain,context_followup,Sure! What would you like me to explain in more detail?
can you clarify,context_followup,Happy to clarify. What part was unclear?
i need more info,context_followup,I can provide more information. Which topic would you like to expand on?
give me more,context_followup,Sure! What would you like more detail about?
additional details,context_followup,I can give additional details. What topic would you like more information on?
keep going,context_followup,I'll continue! What would you like to know next?
explain more,context_followup,Happy to explain more. Which part would you like me to elaborate on?
race distribution,insights_race,Let me pull up the race distribution across the patient population.
racial breakdown,insights_race,Fetching the racial breakdown from the patient database.
patient race statistics,insights_race,Loading race statistics from the clinical database.
how many asian patients,insights_race,Let me count the number of Asian patients in the database.
how many hispanic patients,insights_race,Fetching the count of Hispanic patients from the database.
race insights,insights_race,Here are the race-based insights from the patient population.
ethnicity distribution,insights_race,I can show the ethnicity/race distribution. Fetching data now.
racial statistics,insights_race,Loading racial statistics from the patient records.
how many white patients,insights_race,Let me count the number of White patients in the database.
show race data,insights_race,Pulling up race data from the patient records.
race demographics,insights_race,Fetching race demographic data from the patient population.
race percentages,insights_race,Calculating race percentages across the patient population.
racial disparities,insights_race,Loading data on racial distribution across the patient population.
minority patients,insights_race,Fetching demographic data on minority patients in the database.
racial composition,insights_race,Here is the racial composition of the patient population.
race report,insights_race,Generating a race distribution report from the patient database.
how many black patients,insights_race,Let me count the number of Black/African American patients in the database.
diversity statistics,insights_race,Loading diversity and race statistics from the patient population.
race of patients,insights_race,Here is the race breakdown for all patients in the clinical database.
patient ethnicity,insights_race,Fetching ethnicity data for all patients in the database.
marital status distribution,insights_marital,Let me pull up marital status statistics for the patient population.
how many married patients,insights_marital,Fetching the count of married patients from the database.
single patients,insights_marital,Let me check how many patients are listed as single.
marital breakdown,insights_marital,Here is the marital status breakdown for all patients.
divorce statistics,insights_marital,Fetching divorce/separated patient statistics from the database.
marital status insights,insights_marital,Here are the marital status insights from the clinical population.
how many divorced,insights_marital,Let me count the number of divorced patients in the database.
widowed patients,insights_marital,Fetching data on widowed patients in the clinical database.
patient relationship status,insights_marital,Loading relationship/marital status data from the patient records.
marital demographics,insights_marital,Fetching marital demographic data from the patient population.
marital stats,insights_marital,Loading marital status statistics from the clinical database.
how many single patients,insights_marital,Let me count the number of single patients in the database.
marital status report,insights_marital,Generating a marital status distribution report.
coupled patients,insights_marital,Fetching data on married or partnered patients.
marital status of patients,insights_marital,Here is the marital status breakdown for all patients.
patient diagnoses,diagnosis_lookup,I can look up diagnoses for a specific patient. Please provide the patient ID.
what diagnosis,diagnosis_lookup,Provide a patient ID and I'll retrieve their diagnosis information.
diagnoses for patient,diagnosis_lookup,I can retrieve all diagnoses linked to a patient. What is the patient ID?
diagnosis history,diagnosis_lookup,I'll retrieve the diagnosis history. Please provide the patient ID.
medical history,diagnosis_lookup,I can look up a patient's medical history. Please provide the patient ID.
conditions,diagnosis_lookup,I can retrieve patient conditions/diagnoses. Provide the patient ID.
what diseases,diagnosis_lookup,Let me look up the patient's recorded diseases/diagnoses. Provide the patient ID.
icd code,diagnosis_lookup,I can look up ICD diagnosis codes. Please provide a patient ID or specific code.
diagnosis code,diagnosis_lookup,I can retrieve diagnosis codes for a patient. What is the patient ID?
medical conditions,diagnosis_lookup,I can look up medical conditions by patient ID. Please provide the ID.
show diagnosis,diagnosis_lookup,I can show diagnostic information. Please provide the patient ID.
get diagnoses,diagnosis_lookup,Fetching diagnoses. Please provide the patient ID.
patient health issues,diagnosis_lookup,I can retrieve health issues/diagnoses for a patient. Provide the patient ID.
patient disorders,diagnosis_lookup,I can retrieve patient disorders/diagnoses. Please provide the patient ID.
what was diagnosed,diagnosis_lookup,I can retrieve what was diagnosed for a patient. Please provide the patient ID.
chronic conditions,diagnosis_lookup,I can look up chronic conditions for a patient. Please provide the patient ID.
past diagnoses,diagnosis_lookup,Fetching past diagnosis history. Please provide the patient ID.
current diagnoses,diagnosis_lookup,I can retrieve current diagnoses for a patient. Please provide the patient ID.
top diagnoses,diagnosis_lookup,I can show the most common diagnoses across the patient population.
diagnosis statistics,diagnosis_lookup,Fetching diagnosis frequency data from the clinical database.
admission history,admission_lookup,I can retrieve admission history. Please provide the patient ID.
when was patient admitted,admission_lookup,Provide the patient ID and I'll fetch their admission records.
hospital stays,admission_lookup,I can retrieve hospital stay history. Please provide the patient ID.
admissions,admission_lookup,Fetching admission records. Please provide the patient ID.
patient visits,admission_lookup,I can retrieve patient visit/admission data. What is the patient ID?
how many admissions,admission_lookup,Let me look up the number of admissions for a patient. Provide the patient ID.
admission dates,admission_lookup,I can retrieve the admission and discharge dates. Please provide the patient ID.
discharge date,admission_lookup,I'll look up the discharge date for the patient. Please provide the patient ID.
length of stay,admission_lookup,I can calculate the length of hospital stay. Please provide the patient ID.
show admissions,admission_lookup,Fetching admission records from the database. Please provide the patient ID.
hospital admission,admission_lookup,I can retrieve hospital admission records. Please provide the patient ID.
when admitted,admission_lookup,Provide the patient ID and I'll retrieve their admission date.
when discharged,admission_lookup,I can retrieve the discharge date. Please provide the patient ID.
patient stay,admission_lookup,I can retrieve hospital stay information. Provide the patient ID.
readmission,admission_lookup,I can check if a patient has been readmitted. Please provide the patient ID.
total admissions,admission_lookup,Fetching the total number of admissions for a patient. Please provide the patient ID.
average length of stay,admission_lookup,I can calculate the average length of hospital stay across all patients.
admission record,admission_lookup,I can retrieve admission records. Please provide the patient ID.
how long was patient admitted,admission_lookup,I can calculate the length of each hospital stay. Please provide the patient ID.
list admissions,admission_lookup,Fetching the list of admissions for a patient. Please provide the patient ID.
blah blah blah,unknown,I'm not sure what you mean. Could you rephrase that? Type 'help' to see available commands.
asdfgh,unknown,I didn't understand that. Could you rephrase? Type 'help' for available commands.
random text,unknown,I'm not quite sure what you mean. Try rephrasing your query or type 'help'.
111111,unknown,That doesn't look like a valid command. Type 'help' to see what I can do.
what is the weather,unknown,I'm a clinical chatbot and can only assist with patient and clinical data. Type 'help'.
tell me a joke,unknown,I'm focused on clinical data queries. Type 'help' to see what I can assist with.
play music,unknown,I'm a clinical assistant and don't support that. Type 'help' for what I can do.
search google,unknown,I can only assist with clinical data queries. Type 'help' for available commands.
what is 2 plus 2,unknown,I'm a clinical assistant and can't do math. Type 'help' for what I support.
what time is it,unknown,I don't have access to the clock. I'm here for clinical data queries. Type 'help'.
order food,unknown,I'm a clinical chatbot and can't order food. Type 'help' for available commands.
book a flight,unknown,I can only assist with clinical and patient data queries. Type 'help'.
what is your name,unknown,I'm the Hypotify Clinical Chatbot! Type 'help' to see what I can do.
who made you,unknown,I was built by the Hypotify team to assist with clinical data. Type 'help' for commands.
what commands are available,help,"Here's what I can help with: patient lookup, list patients, clinical insights, translation, medical terms, sentiment analysis, and named entity recognition."
what commands do you have,help,Type 'help' to see the full list of available commands.
what patient data do you have,help,"I can look up patient records, admissions, diagnoses, labs, and population insights. Type 'help' for commands."
what kind of data do you have,help,I support patient lookups, clinical insights, translations, sentiment analysis, and named entity recognition.
can you extract patient names,ner,I can identify who appears in the text. Use: ner <your text>
extract patient names from notes,ner,I can extract proper nouns and named entities. Use: ner <your text>
can you extract names from text,ner,I can find people mentioned in text. Use: ner <your text>
extract names from clinical notes,ner,I can identify names and named entities in text. Use: ner <your text>
show me statistics about the patient population,insights_gender,Fetching gender distribution statistics now.
statistics about patients,insights_gender,Let me look up the gender breakdown for you.
patient population statistics,insights_gender,Loading gender statistics from the clinical database.
how diverse is the patient population,insights_race,Loading diversity and race statistics from the patient population.
